{
  "blueprint_id": "bubble_gentle_v1",
  "display_label": "Bubble Gentle Nuisance",
  "allowed_tiers": ["gentle"],
  "encounter_type": "standard",
  "pressure_style": "soft_nuisance",
  "spell_identity": "bubble",
  "allowed_spell_payloads": [
    {
      "template_id": "bubble_single_tile_gentle_v1",
      "primitive_kind": "apply_tile_state"
    },
    {
      "template_id": "bubble_two_tile_gentle_v1",
      "primitive_kind": "apply_tile_state"
    }
  ],
  "allowed_matchup_pair_pool_ids": ["pair_pool_bubble_gentle_v1"],
  "allowed_habitat_tags": ["meadow", "brook", "sunlit", "starter_friendly", "soft_nature", "waterway"],
  "profile_overrides": {
    "weakness_hit_rate_delta": 0.02,
    "wand_incidence_delta": -0.06,
    "soot_exposure_delta": -0.12,
    "target_casts_to_defeat_delta": -0.5,
    "target_spell_count_on_win_delta": -0.25
  },
  "prohibited_combination_flags": [
    "no_chained_spell_templates",
    "no_tier_above_gentle",
    "no_countdown_below_5",
    "no_multi_state_payloads",
    "no_matchup_shifting"
  ]
}
